{
  "version": 1,
  "id": "name_wider_than_type",
  "question": "Does `artifact` declare a field, a parameter, or a type whose own name states what it holds, while its declared type or definition still admits values that name rules out?\n\nFocus: Breadth is not the finding. A type is right to be broad where the domain really accepts anything: free text, a note, a comment. The finding is a name that makes a claim \u2014 a count, a price, a duration, a URL, a file extension, a code, a percentage \u2014 carried by a definition that admits values contradicting the claim: the empty string where a code is meant, a negative or fractional value where a count is meant, any text at all where one of a few spellings is meant. A named type is judged the same way as a field: the name makes the claim and the definition either holds it or does not. The notation in use must be able to say it: a refinement, a constraint, a narrower type, a union of the values actually allowed.",
  "criteria": {
    "false": "Each name's declared type or definition admits only what its name claims, or the name claims nothing more than the type already says, or the claim is delegated: the declared type is itself a name stating the same claim the field's name makes, so this question applies to that type's declaration rather than here\n\nExamples:\n- a code is a type refined to reject the empty string\n- a count is a type refined to whole numbers not below zero\n- a set of known values is a union of exactly those values\n- a column carries a constraint stating the values it accepts\n- free text such as a title or a body is typed as text, because any text is genuinely allowed\n- a duration named `term` typed `Days`, a rate named `rate` typed `FeePerDay` \u2014 the type's own name carries the claim, and whether it is refined is settled where that type is declared",
    "true": "A field, parameter or type name states what it holds, and what it is defined as admits values that contradict the name\n\nExamples:\n- a field named for a code or an identifier typed as text, so the empty string is admissible\n- a count or a quantity typed as a general number, so negative and fractional values are admissible\n- a field named for a link typed as text, so any text at all is a link\n- a field named for one of a few known values typed as text, so any spelling is admissible\n- a monetary amount typed as a floating-point number, so fractions of the smallest unit are admissible\n- a type named for an identifier defined as plain text, so the empty string inhabits it\n- a type named for a count defined as a plain number, so negatives inhabit it"
  },
  "threshold": 0.7,
  "message": "A field name promises constraints that its type does not enforce.",
  "title": "name wider than type",
  "inputs": [
    {
      "languages": [
        "typescript",
        "rust",
        "bend"
      ],
      "kind": "type",
      "requires": [
        "root-declaration",
        "resolved-outbound-types",
        "selected-source-type-closure"
      ]
    }
  ]
}
